date,scrap_type,title,original_title,score,annee,public,genre,saison,time,pays,langue,description
2022-12-14 17:01:37.146041,serie,Deadwood,Deadwood,8.6/10,2004–2006,16+,Crime, 3,55min,United States,English,"A show set in the late 1800s, revolving around the characters of Deadwood, South Dakota; a town of deep corruption and crime."
2022-12-14 17:00:28.014950,serie,Samurai Champloo,Samurai chanpurû,8.6/10,2004–2005,16+,Animation, 1,24min,Japan,Japanese,"Fuu, a waitress who works in a teahouse, rescues two master swordsmen, Mugen and Jin, from their execution to help her find the ""samurai who smells of sunflowers."""
2022-12-14 17:00:06.765016,serie,North & South,North & South,8.6/10,2004,Tous publics,Drama, 1,235min,United Kingdom,English,"North and South is a four part adaptation of Elizabeth Gaskell's love story of Margaret Hale, a middle class southerner who is forced to move to the northern town of Milton."
2022-12-14 17:00:34.873236,serie,The Venture Bros.,The Venture Bros.,8.6/10,2003–2018,16+,Animation, 7,22min,United States,English,"The bizarre escapades of pseudo-heroic scientist Dr. Rusty Venture, his competent, high-strung bodyguard, and his two overenthusiastic sons."
2022-12-14 17:01:02.584257,serie,QI,QI,8.6/10,2003– ,Tous publics,Comedy,20,30min,United Kingdom,English,"A comedy panel game in which being Quite Interesting is more important than being right. Sandi Toksvig is joined each week by four comedians to share anecdotes and trivia, and maybe answer s..., "
2022-12-14 17:00:02.026063,serie,Trailer Park Boys,Trailer Park Boys,8.6/10,2001–2018,16+,Comedy,12,30min,Canada,English,Three petty felons have a documentary made about their life in a trailer park.
2022-12-14 17:00:43.826751,serie,Justice League,Justice League,8.6/10,2001–2004,Tous publics,Animation, 2,22min,United States,English,Seven of the most formidable heroes form arguably the most powerful team ever.
2022-12-14 17:00:35.294191,serie,Coupling,Coupling,8.6/10,2000–2004,14+,Comedy, 4,30min,United Kingdom,English,Six best friends talk about all aspects of sex and relationships on their never-ending quest to find true love.
2022-12-14 17:00:32.364552,serie,Spaced,Spaced,8.6/10,1999–2001,14+,Action, 1,25min,United Kingdom,English,"Friends Tim and Daisy, 20-something North Londoners with uncertain futures, must pretend to be a couple to live in the only apartment they can afford."
2022-12-14 16:59:56.268210,serie,Rurouni Kenshin: Trust and Betrayal,Rurouni Kenshin: Meiji Kenkaku Romantan: Tsuioku Hen,8.6/10,1999,16+,Animation, 1,118min,Japan,,"In the era of Japan's Meiji Restoration, an assassin regains his humanity."
2022-12-14 16:59:59.856642,serie,From the Earth to the Moon,From the Earth to the Moon,8.6/10,1998,14+,Action, 1,1min,United States,,Dramatized portrayal of the Apollo manned space program.
2022-12-14 17:00:22.645634,serie,I'm Alan Partridge,I'm Alan Partridge,8.6/10,1997–2002,16+,Comedy, 2,29min,United Kingdom,English,"Alan Partridge, a failed television presenter, is now presenting a programme on local radio in Norwich. He desperately tries to revive his broadcasting career."
2022-12-14 17:00:11.939649,serie,Brass Eye,Brass Eye,8.6/10,1997–2001,16+,Comedy, 2,25min,United Kingdom,,"Controversal spoof of current affairs television, and the role of celebrity in the UK."
2022-12-14 17:00:41.507534,serie,Dragon Ball,Dragon Ball,8.6/10,1995–2003,14+,Animation, 9,24min,Japan,Japanese,"Dragon Ball tells the tale of a young warrior by the name of Son Goku, a young peculiar boy with a tail who embarks on a quest to become stronger and learns of the Dragon Balls, when, once a..., "
2022-12-14 17:01:40.636749,serie,The X-Files,The X Files,8.6/10,1993–2018,14+,Crime,11,45min,United States,English,"Two F.B.I. Agents, Fox Mulder the believer and Dana Scully the skeptic, investigate the strange and unexplained, while hidden forces work to impede their efforts."
2022-12-14 17:01:02.679938,serie,Mr. Bean,Mr. Bean,8.6/10,1990–1995,Tous publics,Comedy, 1,25min,United Kingdom,English,"Bumbling, childlike Mr. Bean has trouble completing the simplest of day-to-day tasks, but his perseverance and resourcefulness frequently allow him to find ingenious ways around problems."
2022-12-14 17:00:56.574467,serie,Poirot,Poirot,8.6/10,1989–2013,14+,Crime,13,100min,United Kingdom,English,"The cases of eccentric, but sharp, Belgian detective Hercule Poirot."
2022-12-14 17:01:08.255014,serie,Blackadder the Third,Blackadder the Third,8.6/10,1987,Tous publics,Comedy, 1,3min,United Kingdom,,"In the Regency era, Mr E. Blackadder serves as butler to the foppish numskull Prince George amidst the fads and crazes of the time."
2022-12-14 17:01:10.375327,serie,Dragon Ball,Dragon Ball: Doragon bôru,8.6/10,1986–1989,14+,Animation, 1,24min,Japan,Japanese,"Son Gokû, a fighter with a monkey tail, goes on a quest with an assortment of odd characters in search of the Dragon Balls, a set of crystals that can give its bearer anything they desire."
2022-12-14 17:00:28.642108,serie,"Yes, Prime Minister","Yes, Prime Minister",8.6/10,1986–1987,Tous publics,Comedy, 2,30min,United Kingdom,,James Hacker was propelled along the corridors of power to the very pinnacle of politics - Number 10.
2022-12-14 17:01:26.707922,serie,Blackadder II,Blackadder II,8.6/10,1986,Tous publics,Comedy, 1,176min,United Kingdom,,"In the Tudor court of Elizabeth I, Lord Edmund Blackadder strives to win Her Majesty's favour while attempting to avoid a grisly fate should he offend her."
2022-12-14 17:00:52.434357,serie,The Bugs Bunny Show,The Bugs Bunny Show,8.6/10,1960–1975,Tous publics,Animation, 3,30min,United States,,TV series featuring the classic Looney Tunes animated shorts.
2022-12-14 16:59:53.720171,serie,House of the Dragon,House of the Dragon,8.5/10,2022– ,16+,Action, 1,Not time defined,United States,,"An internal succession war within House Targaryen at the height of its power, 172 years before the birth of Daenerys Targaryen."
2022-12-14 16:59:36.256931,serie,Derry Girls,Derry Girls,8.5/10,2018–2022,16+,Comedy, 3,30min,United Kingdom,English,The personal exploits of a 16-year-old girl and her family and friends during the Troubles in the early 1990s.
2022-12-14 16:59:55.766209,serie,Cobra Kai,Cobra Kai,8.5/10,2018– ,14+,Action, 5,30min,United States,English,"Decades after their 1984 All Valley Karate Tournament bout, a middle-aged Daniel LaRusso and Johnny Lawrence find themselves martial-arts rivals again."
2022-12-14 16:59:37.975672,serie,Big Little Lies,Big Little Lies,8.5/10,2017–2019,16+,Crime, 2,1min,United States,,"The apparently-perfect lives of upper-class mothers of students at a prestigious elementary school unravel to the point of murder when a single mother moves to their quaint California beach ..., "
2022-12-14 16:59:33.292205,serie,The Defiant Ones,The Defiant Ones,8.5/10,2017,16+,Documentary, 1,1min,United States,English,"""The Defiant Ones"" examines the partnership between Jimmy Iovine and Dr. Dre - one the son of a Brooklyn longshoreman, the other straight out of Compton - and their leading roles in a chain ..., "
2022-12-14 17:00:00.086596,serie,Twin Peaks,Twin Peaks,8.5/10,2017,16+,Crime, 1,1min,United States,English,Picks up 25 years after the inhabitants of a quaint northwestern town are stunned when their homecoming queen is murdered.
2022-12-14 17:00:14.247460,serie,Westworld,Westworld,8.5/10,2016–2022,16+,Drama, 4,62min,United States,English,"At the intersection of the near future and the reimagined past, waits a world in which every human appetite can be indulged without consequence."
2022-12-14 16:59:41.723620,serie,The Night Of,The Night Of,8.5/10,2016,16+,Crime, 1,525min,United States,English,"After a night of partying with a woman he picked up, a man wakes up to find her stabbed to death and is charged with her murder."
2022-12-14 16:59:49.661825,serie,The Expanse,The Expanse,8.5/10,2015–2022,14+,Drama, 6,1min,United States,,"In the 24th century, a group of humans untangle a vast plot which threatens the Solar System's fragile state of detente."
2022-12-14 16:59:53.793311,serie,Schitt's Creek,Schitt's Creek,8.5/10,2015–2020,14+,Comedy, 6,22min,Canada,English,"After being a victim of fraud, Johnny Rose and his family go from extremely wealthy to penniless overnight. The only asset left to them is a small, unsophisticated town: Schitt's Creek. They..., "
2022-12-14 16:59:44.203700,serie,Chef's Table,Chef's Table,8.5/10,2015–2019,16+,Documentary, 6,50min,United States,English,"Chef's Table goes inside the lives and kitchens of six of the world's most renowned international chefs. Each episode focuses on a single chef and their unique look at their lives, talents a..., "
2022-12-14 16:59:57.438911,serie,Silicon Valley,Silicon Valley,8.5/10,2014–2019,16+,Comedy, 6,28min,United States,English,"Follows the struggle of Richard Hendricks, a Silicon Valley engineer trying to build his own company called Pied Piper."
2022-12-14 16:59:39.547524,serie,The Knick,The Knick,8.5/10,2014–2015,16+,Drama, 2,58min,United States,,A look at the professional and personal lives of the staff at New York's Knickerbocker Hospital during the early part of the twentieth century.
2022-12-14 16:59:57.723492,serie,Hannibal,Hannibal,8.5/10,2013–2015,16+,Crime, 3,44min,United States,English,Explores the early relationship between renowned psychiatrist Hannibal Lecter and a young FBI criminal profiler who is haunted by his ability to empathize with serial killers.
2022-12-14 16:59:55.961976,serie,Spartacus: Gods of the Arena,Spartacus: Gods of the Arena,8.5/10,2011,16+,Action, 1,331min,United States,English,"In the time before the arrival of Spartacus, the House of Batiatus faces many challenges from competitors, and within its own household."
2022-12-14 17:00:23.509110,serie,Louie,Louie,8.5/10,2010–2015,16+,Comedy, 5,22min,United States,,"The life of Louie C.K., a divorced comedian living in New York with two kids."
2022-12-14 17:00:13.802656,serie,Spartacus,Spartacus: Blood and Sand,8.5/10,2010–2013,16+,Action, 3,55min,United States,English,"The life of Spartacus, the gladiator who lead a rebellion against the Romans. From his time as an ally of the Romans, to his betrayal and becoming a gladiator, to the rebellion he leads and ..., "
2022-12-14 16:59:49.635268,serie,Regular Show,Regular Show,8.5/10,2009–2017,Tous publics,Animation, 8,23min,United States,English,The daily surreal adventures of a blue jay and raccoon duo that attempt to deal with their mundane jobs as groundskeepers at the local park.
2022-12-14 16:59:50.941932,serie,Community,Community,8.5/10,2009–2015,14+,Comedy, 6,22min,United States,English,A suspended lawyer is forced to enroll in a community college with an eccentric staff and student body.
2022-12-14 16:59:34.848622,serie,Southland,Southland,8.5/10,2009–2013,16+,Crime, 5,42min,United States,English,The lives of Police Officers working for the Los Angeles Police Department.
2022-12-14 16:59:23.995005,serie,John Adams,John Adams,8.5/10,2008,14+,Biography, 1,71min,United States,English,"The life of one of the USA's Founding Fathers, its second President, and his role in the nation's first 50 years."
2022-12-14 16:59:43.842259,serie,Generation Kill,Generation Kill,8.5/10,2008,16+,Drama, 1,70min,United States,English,"A Rolling Stone reporter, embedded with The 1st Recon Marines chronicles his experiences during the first wave of the American-led assault on Baghdad in 2003."
2022-12-14 17:00:24.174515,serie,The IT Crowd,The IT Crowd,8.5/10,2006–2013,14+,Comedy, 5,25min,United Kingdom,English,"The comedic misadventures of Roy, Moss and their grifting supervisor Jen, a rag-tag team of IT support workers at a large corporation headed by a hotheaded yuppie."
2022-12-14 16:59:40.255465,serie,The Angry Video Game Nerd,The Angry Video Game Nerd,8.5/10,2004– ,16+,Comedy,16,35min,United States,English,A foul-mouthed nerd reviews bad video games.
2022-12-14 17:00:14.669381,serie,Fullmetal Alchemist,Hagane no renkinjutsushi,8.5/10,2003–2004,Tous publics,Animation, 1,24min,Japan,Japanese,"When a failed alchemical ritual leaves brothers Edward and Alphonse Elric with severely damaged bodies, they begin searching for the one thing that can save them: the fabled philosopher's st..., "
2022-12-14 17:00:29.678367,serie,Battlestar Galactica,Battlestar Galactica,8.5/10,2003,14+,Action, 1,183min,United States,English,"Following the destruction of the Twelve Colonies of Kobol by the Cylons, a rag-tag fugitive fleet of the last remnants of mankind flees the pursuing Cylons while simultaneously searching for..., "
2022-12-14 17:00:12.377389,serie,Samurai Jack,Samurai Jack,8.5/10,2001–2017,16+,Animation, 5,25min,United States,,"A samurai, sent through time, fights to return home and save the world."
2022-12-14 17:00:17.723847,serie,The Office,The Office,8.5/10,2001–2003,16+,Comedy, 3,30min,United Kingdom,English,"The story of an office that faces closure when the company decides to downsize its branches. A documentary film crew follow staff and the manager David Brent as they continue their daily liv..., "
2022-12-14 16:59:33.435091,serie,Black Books,Black Books,8.5/10,2000–2004,Tous publics,Comedy, 3,25min,United Kingdom,English,"Bernard Black runs a book shop, though his customer service skills leave something to be desired. He hires Manny as an employee. Fran runs the shop next door. Between the three of them many ..., "
2022-12-14 16:59:57.900724,serie,Futurama,Futurama,8.5/10,1999–2023,14+,Animation,10,22min,United States,English,"Philip J. Fry, a pizza delivery boy, is accidentally frozen in 1999 and thawed out on New Year's Eve 2999."
2022-12-14 17:00:18.615442,serie,Whose Line Is It Anyway?,Whose Line Is It Anyway?,8.5/10,1998–2007,Tous publics,Comedy, 8,30min,United States,,"Improvisational comedy competition show in which four members of the regular cast as comedians and often with guest appearances with other comedians and celebrities and members of the audien..., "
2022-12-14 17:00:11.313588,serie,Neon Genesis Evangelion,Shin seiki evangerion,8.5/10,1995–1996,16+,Animation, 1,24min,Japan,,A teenage boy finds himself recruited as a member of an elite team of pilots by his father.
2022-12-14 16:59:28.285512,serie,X-Men: The Animated Series,X-Men,8.5/10,1992–1997,7+,Animation, 5,23min,United States,English,A team of mutant superheroes fight for justice and human acceptance in the Marvel Comics universe.
2022-12-14 16:59:49.042187,serie,Alfred Hitchcock Presents,Alfred Hitchcock Presents,8.5/10,1955–1962,14+,Comedy, 7,25min,United States,,"Series of unrelated short stories covering elements of crime, horror, drama, and comedy about people of different backgrounds committing murders, suicides, thefts, and other sorts of crime c..., "
